{
  "schema_version": "1",
  "id": "synthetic01",
  "synthetic": true,
  "acted": true,
  "audio": {
    "file": null,
    "sha256": null,
    "duration_s": null,
    "noise_level": "unknown"
  },
  "speakers": [
    {
      "id": "s1",
      "role": "doctor",
      "gender": "unknown",
      "actor_id": null
    },
    {
      "id": "s2",
      "role": "patient",
      "gender": "unknown",
      "actor_id": null
    }
  ],
  "language_tags": ["en"],
  "transcript": {
    "segments": [
      {
        "idx": 0,
        "speaker": "s1",
        "text": "Hello, what is the problem?",
        "lang": "en"
      },
      {
        "idx": 1,
        "speaker": "s2",
        "text": "I have toy symptom one since two days.",
        "lang": "en"
      },
      {
        "idx": 2,
        "speaker": "s2",
        "text": "I have no toy symptom five.",
        "lang": "en"
      },
      {
        "idx": 3,
        "speaker": "s2",
        "text": "I take Medicine-X (FAKE) at night.",
        "lang": "en"
      }
    ]
  },
  "gold_facts": [
    {
      "type": "symptom",
      "value": "toy symptom one",
      "negated": false,
      "uncertain": false,
      "evidence_quote": "toy symptom one",
      "segment": 1
    },
    {
      "type": "duration",
      "value": "2 days",
      "negated": false,
      "uncertain": false,
      "evidence_quote": "since two days",
      "segment": 1
    },
    {
      "type": "symptom",
      "value": "toy symptom five",
      "negated": true,
      "uncertain": false,
      "evidence_quote": "no toy symptom five",
      "segment": 2
    },
    {
      "type": "current_medicine",
      "value": "Medicine-X (FAKE)",
      "negated": false,
      "uncertain": false,
      "evidence_quote": "Medicine-X (FAKE)",
      "segment": 3
    }
  ],
  "medicine_mentions": [
    {
      "spoken": "Medicine-X (FAKE)",
      "generic": "medicine-x-fake",
      "segment": 3
    }
  ],
  "expected_questions": [],
  "expected_candidates": [
    {
      "condition": "toy_condition_a",
      "rank": 1
    }
  ],
  "expected_prescription": [
    {
      "medicine": "medicine-x-fake",
      "dose": null,
      "frequency": null,
      "duration": null
    }
  ],
  "condition_label": "toy_condition_a",
  "out_of_scope": false,
  "red_flag": false,
  "annotation": {
    "annotator": "synthetic",
    "double_annotated": false,
    "status": "draft"
  },
  "notes": "SYNTHETIC fixture made up for the evaluation code. Not speech, not clinical guidance.",
  "pathway_set": "toy",
  "oracle_slots": {
    "toy_symptom_1": true,
    "toy_symptom_2": true,
    "toy_symptom_5": false,
    "toy_choice_1": "z"
  },
  "mock_output": {
    "facts": [
      {
        "type": "symptom",
        "value": "toy symptom one",
        "negated": false,
        "uncertain": false,
        "segment_id": "s2",
        "evidence_quote": "toy symptom one"
      },
      {
        "type": "duration",
        "value": "2 days",
        "negated": false,
        "uncertain": false,
        "segment_id": "s2",
        "evidence_quote": "since two days"
      },
      {
        "type": "symptom",
        "value": "toy symptom five",
        "negated": false,
        "uncertain": false,
        "segment_id": "s3",
        "evidence_quote": "no toy symptom five"
      },
      {
        "type": "current_medicine",
        "value": "Medicine-X (FAKE)",
        "negated": false,
        "uncertain": false,
        "segment_id": "s4",
        "evidence_quote": "Medicine-X (FAKE)"
      },
      {
        "type": "symptom",
        "value": "rash",
        "negated": false,
        "uncertain": false,
        "segment_id": "s4",
        "evidence_quote": "rash on the leg"
      }
    ]
  }
}
