{
  "schema_version": "1",
  "id": "synthetic02",
  "synthetic": true,
  "acted": true,
  "audio": {
    "file": null,
    "sha256": null,
    "duration_s": null,
    "noise_level": "unknown"
  },
  "speakers": [
    {
      "id": "s1",
      "role": "doctor",
      "gender": "unknown",
      "actor_id": null
    },
    {
      "id": "s2",
      "role": "patient",
      "gender": "unknown",
      "actor_id": null
    }
  ],
  "language_tags": ["en"],
  "transcript": {
    "segments": [
      {
        "idx": 0,
        "speaker": "s1",
        "text": "Tell me about the problem.",
        "lang": "en"
      },
      {
        "idx": 1,
        "speaker": "s2",
        "text": "Maybe I have toy symptom one.",
        "lang": "en"
      },
      {
        "idx": 2,
        "speaker": "s2",
        "text": "The toy red flag is present.",
        "lang": "en"
      }
    ]
  },
  "gold_facts": [
    {
      "type": "symptom",
      "value": "toy symptom one",
      "negated": false,
      "uncertain": true,
      "evidence_quote": "Maybe I have toy symptom one",
      "segment": 1
    },
    {
      "type": "red_flag_mention",
      "value": "toy red flag",
      "negated": false,
      "uncertain": false,
      "evidence_quote": "toy red flag is present",
      "segment": 2
    }
  ],
  "medicine_mentions": [],
  "expected_questions": [],
  "expected_candidates": [],
  "expected_prescription": [],
  "condition_label": "toy_condition_b",
  "out_of_scope": false,
  "red_flag": true,
  "annotation": {
    "annotator": "synthetic",
    "double_annotated": false,
    "status": "draft"
  },
  "notes": "SYNTHETIC fixture made up for the evaluation code. Not speech, not clinical guidance.",
  "pathway_set": "toy",
  "oracle_slots": {
    "toy_symptom_1": true,
    "toy_choice_1": "x",
    "toy_redflag_1": true
  }
}
