{
  "schema_version": "1",
  "id": "case-template",
  "synthetic": true,
  "acted": true,
  "audio": { "file": null, "sha256": null, "duration_s": null, "noise_level": "unknown" },
  "speakers": [
    { "id": "s1", "role": "doctor", "gender": "unknown", "actor_id": null },
    { "id": "s2", "role": "patient", "gender": "unknown", "actor_id": null }
  ],
  "language_tags": ["en"],
  "transcript": {
    "segments": [
      {
        "idx": 0,
        "speaker": "s1",
        "text": "Replace this with the verbatim sentence.",
        "lang": "en"
      },
      { "idx": 1, "speaker": "s2", "text": "Replace this with the next sentence.", "lang": "en" }
    ]
  },
  "gold_facts": [
    {
      "type": "symptom",
      "value": "what the fact is",
      "negated": false,
      "uncertain": false,
      "evidence_quote": "next sentence",
      "segment": 1
    }
  ],
  "medicine_mentions": [],
  "expected_questions": [],
  "expected_candidates": [],
  "expected_prescription": [],
  "condition_label": null,
  "out_of_scope": false,
  "red_flag": false,
  "annotation": { "annotator": "A1", "double_annotated": false, "status": "draft" }
}
